train_hindifullfemale_05179| I don't know what I have been mumbling, but I said anything improper, please forgive me. 
train_hindifullfemale_05180| The king spoke no more, but the servant knew he had sowed the seed of distrust. 
train_hindifullfemale_05181| The king thought, It can be true! The servant moves about the palace freely, and so does the merchant. 
train_hindifullfemale_05182| It is possible that the servant has seen something. 
train_hindifullfemale_05183| The king was troubled with jealousy. 
train_hindifullfemale_05184| From that day onwards, he withdrew his favours from the merchant and even forbade him to enter the palace. 
train_hindifullfemale_05185| One day, when the merchant was entering the gateway to the palace, he was stopped by the guards. 
train_hindifullfemale_05186| The merchant was surprised due to this sudden change in the king's attitude. 
train_hindifullfemale_05187| The servant was nearby, and mocking shouted at the guards, Ho Guards! That merchant is favoured by the king, He is a powerful person. 
train_hindifullfemale_05188| He can have people arrested or released or even thrown out, just like he had me thrown out of his daughter's reception. 
train_hindifullfemale_05189| Beware, for you may suffer the same fate. 
train_hindifullfemale_05190| On hearing this, the merchant understood that the servant had caused all this trouble somehow. 
train_hindifullfemale_05191| He felt dejected, and returned home upset over the incident. 
train_hindifullfemale_05192| He gave everything a second thought, and then he invited the royal servant to his house. 
train_hindifullfemale_05193| He treated the servant with utmost respect, and flattered him with gifts and garments. 
train_hindifullfemale_05194| He said kindly, O friend, that day I did not have you thrown out due to anger, but it was improper of you to occupy the seat reserved for the royal nobles. 
train_hindifullfemale_05195| They felt insulted, and out of compulsion I had to throw you out. Please forgive me. 
train_hindifullfemale_05196| The servant was already flattered with all the gifts, and he was full of joy, Sir, I forgive you. You have not only expressed your regrets, but also honoured me with utmost respect. 
train_hindifullfemale_05197| He ensured the merchant, I will prove you how clever I am. 
train_hindifullfemale_05198| I will have the king favourable towards you, like he was before. 
train_hindifullfemale_05199| The servant went back home. 
train_hindifullfemale_05200| Early next morning, when he started sweeping the floors of the palace, he waited till when the king was lying half-awake. 
train_hindifullfemale_05201| When the opportunity came, he started sweeping around his bed and started mumbling, Our king is crazy, he eats cucumber in the lavatory! 
train_hindifullfemale_05202| On hearing this, the king was taken aback. 
train_hindifullfemale_05203| He got up angrily and shouted at the servant, What nonsense do you talk about? Had you not been my royal servant, I would have punished you dearly. 
train_hindifullfemale_05204| Have you ever seen me doing such thing yourself? 
train_hindifullfemale_05205| Once again the servant fell on his knees and prayed, O Master, please forgive me if I said something improper. 
train_hindifullfemale_05206| The king thought to himself, I have never eaten a cucumber in the lavatory. 
train_hindifullfemale_05207| What he mumbled about me is ridiculously false. 
train_hindifullfemale_05208| Surely then, what he mumbled about my trusted merchant the other morning must have been ridiculously false too. 
train_hindifullfemale_05209| It was improper of me to mistreat the merchant. 
train_hindifullfemale_05210| He wondered, After all he has been so efficient in the whole administrative system, that without him it has become slack. 
train_hindifullfemale_05211| Thus, having considered carefully, the king invited the merchant to the palace and flattered him with gifts, jewels and garments. 
train_hindifullfemale_05212| He re-appointed the merchant to his previously held position, and favoured his services as before. 
train_hindifullfemale_05213| The wise indeed say, One should treat one and all, even the lowest, with respect. 
train_hindifullfemale_05214| Once upon a time, there was a sage called Deva Sharma who lived in a temple in the outskirts of a town. 
train_hindifullfemale_05215| He was widely known and respected. 
train_hindifullfemale_05216| People would visit him, and offer him with gifts, food, money and garments to seek his blessings. 
train_hindifullfemale_05217| The gifts that he did not need for himself, he would sell off, and got rich on the proceeds. 
train_hindifullfemale_05218| And by nature, he trusted nobody. 
train_hindifullfemale_05219| So, he kept all his money in a bag which he carried under his arm all the time. 
train_hindifullfemale_05220| He would not part with the bag for a single moment. 
train_hindifullfemale_05221| One day, a swindler came across the sage, and he became sure that the bag this holy man was so possessive of, must surely contain a lot of treasure. 
train_hindifullfemale_05222| He planned on stealing the bag from the sage, but could not think of a way to do so. 
train_hindifullfemale_05223| He thought, I cannot make a hole in the temple wall, or jump over the high gates. 
train_hindifullfemale_05224| But I can charm him with sweet words to accept me as his disciple. 
train_hindifullfemale_05225| He wondered, If I can stay with him as a disciple, I can win his confidence. When I get an opportunity, I will rob him, and leave this place. 
train_hindifullfemale_05226| Having planned so, the swindler approached the holy man with reverence, Om Namah Shivaya! I bow before Lord Shiva, the God of Destruction. 
train_hindifullfemale_05227| With these words, he fell on the sage's feet and said, O Guruji, Please guide me to the right path of life. 
train_hindifullfemale_05228| I am fed-up with life, and want to seek peace. 
train_hindifullfemale_05229| The sage kindly replied, My son, I will surely guide you. 
train_hindifullfemale_05230| You are blessed because you have come to me to seek peace at this young age. 
train_hindifullfemale_05231| This was the opportunity the swindler was seeking, and he at once touched the feet of the sage for blessings, O Guruji, please accept me as your disciple. I will do whatever you ask me to do. 
train_hindifullfemale_05232| The sage accepted the swindler as his disciple, but only on a condition. 
train_hindifullfemale_05233| He said, A holy man as me is recommended to spend the night alone without company. 
train_hindifullfemale_05234| This helps me to meditate also. 
train_hindifullfemale_05235| So, you will not be allowed to enter the temple at night. 
train_hindifullfemale_05236| You will sleep in a hut at the gate of the temple. 
train_hindifullfemale_05237| The swindler agreed, I shall willingly serve your wishes in every way that you ask me to. 
train_hindifullfemale_05238| In the evening, the sage initiated the rituals and formally took the swindler as his disciple. 
train_hindifullfemale_05239| The swindler in return proved himself an obedient disciple. 
train_hindifullfemale_05240| He massaged his hands and feet, washed his feet and helped him with all the rituals along with cleaning the temple. 
train_hindifullfemale_05241| Although the sage was happy with his disciple, the swindler could not gain enough confidence for the sage to part with his bag when he was around. 
train_hindifullfemale_05242| As days passed by, the swindler started getting frustrated, 
train_hindifullfemale_05243| He does not trust me enough to leave the bag with me. 
train_hindifullfemale_05244| I can gain access to the bag if I kill him with a knife or feed him with poison. 
train_hindifullfemale_05245| When he was thinking all this, the swindler saw a young boy visit the sage. 
train_hindifullfemale_05246| He was the son of one of the sage's followers. 
train_hindifullfemale_05247| He invited the sage, O Guruji, I have come here personally to invite you to our house for the ceremony of sacred thread. 
train_hindifullfemale_05248| Please accept the invitation to sanctify the ceremony with your kind presence. 
train_hindifullfemale_05249| The sage accepted the invitation, and after some time started off for the town with the swindler. 
train_hindifullfemale_05250| On the way, they came across a river, where the sage thought of relieving himself. 
train_hindifullfemale_05251| He folded the bagful of money in his robe. 
train_hindifullfemale_05252| He asked his disciple to look after it, My child, Look after the robe until I return. 
train_hindifullfemale_05253| This was the opportunity that the swindler was seeking all the while. 
train_hindifullfemale_05254| As soon as the sage went behind the bushes, the swindler ran away with the bagful of money. 
train_hindifullfemale_05255| When the sage returned, he did not find the disciple around but found his robe lying on the ground. 
train_hindifullfemale_05256| Shocked and anxious, he peered inside only to find his bag of money was gone. 
train_hindifullfemale_05257| At once he knew what had happened, and began to shout, Oh! Where are you, you rascal. You have robbed me. 
train_hindifullfemale_05258| The sage then started trailing the swindler's footsteps, but he reached town. 
train_hindifullfemale_05259| He knew he will not be able to catch hold of him. 
train_hindifullfemale_05260| He stayed the night in town to return empty-handed to his temple next morning. 
train_hindifullfemale_05261| The wise indeed say, Do not be taken in by the sweet words of a swindler. 
train_hindifullfemale_05262| One day while a sage was going through a jungle, he saw two golden rams fighting each other. 
train_hindifullfemale_05263| Even though both were wounded, and blood was oozing out from their heads and bodies, they did not stop fighting and rammed at each other. 
train_hindifullfemale_05264| At the same time, a hungry jackal was passing by. 
train_hindifullfemale_05265| When he saw all the blood, he started licking the blood from the ground without caring for the fighting rams. 
train_hindifullfemale_05266| Watching all this, the sage thought to himself, This jackal is a fool as it has become greedy by the smell of blood. 
train_hindifullfemale_05267| If he comes between the fighting rams, it will get rammed and get hurt himself. 
train_hindifullfemale_05268| No sooner had the sage thought of it, the jackal craving for more blood came nearer to the fighting rams, and got caught in the middle of their fight. 
train_hindifullfemale_05269| Both the rams rammed into him by mistake. 
train_hindifullfemale_05270| He got hit on his head, and fell down because he was severely wounded. 
train_hindifullfemale_05271| The wise indeed say, Do not close your eyes to the impending danger due to greed. 
train_hindifullfemale_05272| There was a big banyan tree, where two crows - husband and wife, had prepared a nice nest and made it their home. 
train_hindifullfemale_05273| In the hollow of the same tree, lived a black cobra. 
train_hindifullfemale_05274| The crows had a problem because the black cobra would climb up the tree and eat the newborns, whenever the female crow hatched her eggs. 
train_hindifullfemale_05275| They could do nothing to save them. 
train_hindifullfemale_05276| The crows went to a jackal, who lived in a nearby banyan tree, to seek his advice. 
train_hindifullfemale_05277| They narrated everything to him and requested his advice for them to get rid of their problem. 
train_hindifullfemale_05278| They said, O Friend, It has become dangerous to live here. 
train_hindifullfemale_05279| Please tell us how we can protect our children from being eaten up by the wicked black cobra. 
train_hindifullfemale_05280| The jackal replied, Please don't give up. Even powerful enemies can be overcome with the use of wit. 
train_hindifullfemale_05281| On hearing this, the crows requested, O Friend, please tell us how we can overcome and destroy this wicked cobra. 
train_hindifullfemale_05282| The jackal told them a plan, Fly into the capital of the kingdom, not far from here. 
train_hindifullfemale_05283| Visit the house of someone who is wealthy and careless at the same time. 
train_hindifullfemale_05284| Notice if something of value is lying around. 
train_hindifullfemale_05285| If you find so, pick it up when the servants are watching you. 
train_hindifullfemale_05286| He continued, You will need to fly slowly so that the servants can follow you. Return back to your tree and drop it in the hollow of the tree where the cobra lives. When the servants reach, they will kill the cobra when they see it. 
train_hindifullfemale_05287| The crows decided to follow the jackal's advice and flew off immediately according to his plan. 
train_hindifullfemale_05288| As they flew above the capital, the female crow noticed wealthy women swimming in a lake. 
train_hindifullfemale_05289| They had left gold and pearl necklaces on the banks of the lake, which were guarded by royal servants. 
train_hindifullfemale_05290| At once the female crow swooped down, and picked up a big necklace in her beak, and started flying slowly. 
train_hindifullfemale_05291| When the royal servants noticed her, they picked up sticks and stones, and started throwing at her, and ran to chase her. 
train_hindifullfemale_05292| As planned, she dropped the necklace in front of the hollow of the tree, where the black cobra was asleep. 
train_hindifullfemale_05293| She sat on one of the branches for the royal servants to notice. 
train_hindifullfemale_05294| When the royal servants arrived, the black cobra came out of the hollow of the tree to see what all the noise was about. 
train_hindifullfemale_05295| The black cobra confronted the king's servants with swelling hood, but the servants attacked the cobra with sticks and stones to recover the necklace. 
train_hindifullfemale_05296| They killed the wicked cobra, and returned with the necklace. 
train_hindifullfemale_05297| And the crows, having gotten rid of the cobra, lived happily. 
train_hindifullfemale_05298| The wise indeed say, Even a very powerful enemy can be destroyed through deceit. 
train_hindifullfemale_05299| A heron lived near a big lake, which was full of fishes and other water creatures. 
train_hindifullfemale_05300| The heron had grown so old, that he could not catch fishes from the lake anymore. 
train_hindifullfemale_05301| He became lean and weak with every passing day due to lack of food. 
train_hindifullfemale_05302| Unable to bear the hunger anymore, he hit upon a plan. 
train_hindifullfemale_05303| As planned, he sat at the edge of the lake for everybody to see, and began crying. 
train_hindifullfemale_05304| On seeing this, a crab took pity on him and went near, Uncle, What is the matter? Why are you crying instead of catching fishes? 
train_hindifullfemale_05305| Continuing to pretend, the heron replied, My child, I would not touch any fish anymore. I have decided to renounce all worldly matters, and vowed to undertake a fast unto death. 
train_hindifullfemale_05306| The crab asked, If you have indeed renounced worldly matters, why is it that you cry? 
train_hindifullfemale_05307| The heron explained, My child, I have been in this lake from my birth. I have grown here. 
train_hindifullfemale_05308| And now that I have grown so old that I hear that this lake will dry up as there will be no rains for the next twelve years. 
train_hindifullfemale_05309| The crab was surprised to hear this, Uncle, please tell me if it is true. Please tell me where you have heard such thing. 
train_hindifullfemale_05310| The heron replied, I have heard the news from a wise astrologer that there will be no rains for the next twelve years. 
train_hindifullfemale_05311| You see, there is already not much water in the lake. 
train_hindifullfemale_05312| And very soon, due to lack of rains, the lake will dry up completely very soon. 
train_hindifullfemale_05313| The crab was taken a back by the news of what is to be fall on them, and went to tell this to the other water creatures. 
train_hindifullfemale_05314| On hearing this piece of news, everybody started to panic. 
train_hindifullfemale_05315| They believed the heron, as he was not trying to catch any fish at all. 
train_hindifullfemale_05316| So, they met the heron to seek advice, Please guide us to save us from this disaster 
train_hindifullfemale_05317| The heron said, There is indeed a lake not far from here. It is full of water, and beautifully covered with lotus flowers. 
train_hindifullfemale_05318| There is so much water in the lake, that it would not dry even if it did not rain for twenty four years. 
train_hindifullfemale_05319| I can take you there, if you can ride on my back. 
train_hindifullfemale_05320| He had already gained their confidence. 
train_hindifullfemale_05321| So, they gathered around him and requested to carry them one at a time to the other lake and save them. 
train_hindifullfemale_05322| The wicked heron had succeeded in his plan. 
train_hindifullfemale_05323| Every day, he would carry one of them on his back, pretending to take them to the other lake. 
train_hindifullfemale_05324| After flying a little away from the lake, he would smash them against a rock and eat them up. 
train_hindifullfemale_05325| He would then return after some time to the lake and repeat false messages how they are happy in the other lake. 
train_hindifullfemale_05326| This happened for many days, when the crab said to the heron, Uncle, you take others to the lake but it is me who is your first friend. 
train_hindifullfemale_05327| Please take me to the other lake to save my life. 
train_hindifullfemale_05328| The heron was happy to hear this. He thought to himself, Having a fish everyday has become monotonous. It is good that I will get to eat a crab today, for a change. 
train_hindifullfemale_05329| Having thus decided, the heron started carrying the crab to the same rock. 
train_hindifullfemale_05330| The crab looked down from above and saw the heap of bones and skeletons. 
train_hindifullfemale_05331| At once, the crab understood what the heron was up to. 
train_hindifullfemale_05332| He remained calm, and said to the heron, Uncle, the lake seems far and I am quite heavy. 
train_hindifullfemale_05333| You must be getting tired, let us stop for some rest. 
train_hindifullfemale_05334| The heron was confident that there was no way the crab can escape from him in the sky. 
train_hindifullfemale_05335| The heron replied, there is no lake for real. 
train_hindifullfemale_05336| This trip is for my own meal. 
train_hindifullfemale_05337| As I do every day, I will smash you against a rock and make a meal out of you. 
train_hindifullfemale_05338| When the heron confessed the truth, the crab got hold of the heron's neck with its strong claws, and strangled him to death. 
train_hindifullfemale_05339| The crab laughed at himself that he had saved himself and the other water creatures from the trick played by the heron. 
train_hindifullfemale_05340| He dragged the heron back to the lake. 
train_hindifullfemale_05341| The other water creatures in the lake were surprised to see him back. 
train_hindifullfemale_05342| They became curious, and asked all sort of questions. 
train_hindifullfemale_05343| The crab laughed and replied, We were being made fools! The heron was an imposter and what he told you about the lake drying up was all false. 
train_hindifullfemale_05344| He was taking one of us every day for his meal in a rock not far from here. 
train_hindifullfemale_05345| He proudly said, I understood what he was up to, and have killed the trickster. 
train_hindifullfemale_05346| There is no need to worry, for we are safe in this lake. 
train_hindifullfemale_05347| It is not going to dry up at all. 
train_hindifullfemale_05348| The wise indeed say, When things go wrong, use your wit to overcome the situation. 
train_hindifullfemale_05349| Mandavisarpini was a white flea. 
train_hindifullfemale_05350| She lived in the folds of the exquisite white silk sheet that covered the bed of a king in a certain country. 
train_hindifullfemale_05351| She fed on the king's blood without anybody noticing, and was happy to spend her days. 
train_hindifullfemale_05352| One day, a bug managed to enter the beautifully decorated bedroom of the king. 
train_hindifullfemale_05353| When the flea saw him, she warned, O Bug, what are you doing in the king's bedroom. Leave at once before you get caught! 
train_hindifullfemale_05354| The bug replied, Madam, even if I were a good-for-nothing bug, that is no way to treat a guest. 
train_hindifullfemale_05355| One should welcome a guest with humble words, sweet behaviour and offer refreshments. 
train_hindifullfemale_05356| The bug continued, I have fed myself with all types of blood, but never have I had the pleasure of the blood of a king. 
train_hindifullfemale_05357| It must be very sweet, for the king eats the choicest of food. 
train_hindifullfemale_05358| I would love to taste the king's blood, if you permit. 
train_hindifullfemale_05359| The flea was taken aback, O Bug, you have a nasty bite, like a sharp needle. 
train_hindifullfemale_05360| Besides, I feed on the king's blood only when he is deep into his sleep. 
train_hindifullfemale_05361| I can permit you to feed on the king's blood only if you promise to wait till he is asleep. 
train_hindifullfemale_05362| The bug agreed, I promise to wait till the king is asleep, and only after you have fed yourself, will I feed myself on his blood. 
train_hindifullfemale_05363| Soon after they decided on such terms, the king came to his bedroom and lay down to sleep. 
train_hindifullfemale_05364| The bug could not control himself, and decided to take a tiny bite of the king, without waiting. 
train_hindifullfemale_05365| As the king was yet to fall asleep, he jumped at the sharp bite of the bug. 
train_hindifullfemale_05366| The king shouted at his servants, Hey, there is something in my bed that has bitten me. 
train_hindifullfemale_05367| Look for it, as I have already been bitten. 
train_hindifullfemale_05368| On hearing this, the bug quickly hid himself in a corner of the bed, before the servants could start searching for him. 
train_hindifullfemale_05369| However, the servants scrutinized the entire bed, sheet by sheet, and found the flea between the folds. 
train_hindifullfemale_05370| They killed her at once, and the king went to sleep without anymore worries. 
train_hindifullfemale_05371| The wise indeed say, the false promises of friends as well as strangers have no value. You end up paying for it. 
train_hindifullfemale_05372| There was once a jungle that was ruled by a lion called Madotkata, who had a leopard, a jackal and a crow at his service, along with other animals. 
train_hindifullfemale_05373| As they did regularly, they were wandering about the jungle one day, when the lion saw a camel at a distance. 
train_hindifullfemale_05374| This camel had separated from its caravan and was feeding itself on the green grass of the jungle. 
train_hindifullfemale_05375| The lion took a fancy on this animal that he had not seen before, Let us go and ask this extraordinary animal, where he comes from. 
train_hindifullfemale_05376| The crow, who flies to far-off places was aware and replied, Master, it is called a camel and this animal lives in villages. 
train_hindifullfemale_05377| The flesh of this animal tastes good, let us kill it and eat it. 
train_hindifullfemale_05378| But the lion disagreed, He does not belong to the jungle, so he is our guest. I will not kill it. 
train_hindifullfemale_05379| Please go and assure him that no harm will be done, and bring him to me. 
train_hindifullfemale_05380| As per the lion's instruction, they went to the camel and assured him that they were to bring it to the lion. 
train_hindifullfemale_05381| They won his confidence, and they brought the camel to the lion. 
train_hindifullfemale_05382| The camel stood before the lion and bowed. 
train_hindifullfemale_05383| He also narrated how he had gotten separated from his caravan and how he had reached the jungle. 
train_hindifullfemale_05384| On hearing this, the lion said, Oh Camel, if you return to the village you will be made a beast to carry burden again. 
train_hindifullfemale_05385| Stay in the jungle under my kingdom instead. 
train_hindifullfemale_05386| You can feast on the abundant green grass of the jungle without any fear. 
train_hindifullfemale_05387| The camel accepted the offer, and they began to live together in peace. 
train_hindifullfemale_05388| Later one day, the lion got severely wounded in a fight with a mad elephant. 
train_hindifullfemale_05389| Such were his injuries that he could not take a few steps, let alone go out for hunting. 
train_hindifullfemale_05390| Due to lack of food, the lion became weaker. 
train_hindifullfemale_05391| The animals who served him were also starving since they were dependent on the lion for their food. 
train_hindifullfemale_05392| When the lion could not bear anymore, he called them and said, Go and find any animal that I can prey upon even in my weak condition. 
train_hindifullfemale_05393| This way I can provide food for you, and also for myself. 
train_hindifullfemale_05394| All the animals wandered about the jungle without any success to find such an animal. 
train_hindifullfemale_05395| On their way back, the jackal had a plan. 
train_hindifullfemale_05396| He said to the crow, there is no point wandering about the jungle when the food is right in front of us. 
train_hindifullfemale_05397| The camel can provide us with the food for all of us for a long time. 
train_hindifullfemale_05398| The crow replied, Indeed, what you say is correct. 
