train_hindifullfemale_01779| Now this Elephant had a son who was white all over, a beautiful, strong young one. 
train_hindifullfemale_01780| The old Elephant said to himself, I will take my son to the place in the forest. 
train_hindifullfemale_01781| I go to work there each day so that he may learn to help the carpenters, for I am no longer young and strong. 
train_hindifullfemale_01782| So the old Elephant told his son how the carpenters had taken good care of him when he was badly hurt and took him to them. 
train_hindifullfemale_01783| The white Elephant did as his father told him to do and helped the carpenters and they fed him well. 
train_hindifullfemale_01784| When the work was done at night the young Elephant went to play in the river. 
train_hindifullfemale_01785| The carpenters' children played with him, in the water and on the bank. 
train_hindifullfemale_01786| He liked to pick them up in his trunk and set them on the high branches of the trees and then let them climb down on his back. 
train_hindifullfemale_01787| One day the king came down the river and saw this beautiful white Elephant working for the carpenters. 
train_hindifullfemale_01788| The king at once wanted the Elephant for his own and paid the carpenters a great price for him. 
train_hindifullfemale_01789| Then with a last look at his playmates, the children, the beautiful white Elephant went on with the king. 
train_hindifullfemale_01790| The king was proud of his new Elephant and took the best care of him as long as he lived. 
train_hindifullfemale_01791| Once upon a time there was an Ox named Big Red. 
train_hindifullfemale_01792| He had a younger brother named Little Red. 
train_hindifullfemale_01793| These two brothers did all the carting on a large farm. 
train_hindifullfemale_01794| Now the farmer had an only daughter and she was soon to be married. 
train_hindifullfemale_01795| Her mother gave orders that the Pig should be fattened for the wedding feast. 
train_hindifullfemale_01796| Little Red noticed that the Pig was fed on choice food. 
train_hindifullfemale_01797| He said to his brother, How is it, Big Red, that you and I are given only straw and grass to eat, We do all the hard work on the farm? 
train_hindifullfemale_01798| That lazy Pig does nothing but eat the choice food the farmer gives him. 
train_hindifullfemale_01799| Said his brother, My dear Little Red, do not envy him. 
train_hindifullfemale_01800| That little Pig is eating the food of death! 
train_hindifullfemale_01801| He is being fattened for the wedding feast. 
train_hindifullfemale_01802| Eat your straw and grass and be content and live long. 
train_hindifullfemale_01803| Not long afterwards the fattened Pig was killed and cooked for the wedding feast. 
train_hindifullfemale_01804| Then Big Red said, Did you see, Little Red, what became of the Pig after all his fine feeding? 
train_hindifullfemale_01805| Yes, said the little brother, we can go on eating plain food for years. 
train_hindifullfemale_01806| The poor little Pig ate the food of death and now he is dead. 
train_hindifullfemale_01807| His feed was good while it lasted, but it did not last long. 
train_hindifullfemale_01808| Once upon a time a rich man gave a baby Elephant to a woman. 
train_hindifullfemale_01809| She took the best of care of this great baby and soon became very fond of him. 
train_hindifullfemale_01810| The children in the village called her Granny, and they called the Elephant Granny's Blackie. 
train_hindifullfemale_01811| The Elephant carried the children on his back all over the village. 
train_hindifullfemale_01812| They shared their goodies with him and he played with them. 
train_hindifullfemale_01813| Please, Blackie, give us a swing, they said to him almost every day. 
train_hindifullfemale_01814| Come on! Who is first? Blackie answered and picked them up with his trunk, swung them high in the air. 
train_hindifullfemale_01815| Then he put them down again, carefully. 
train_hindifullfemale_01816| But Blackie never did any work. 
train_hindifullfemale_01817| He ate and slept, played with the children, and visited Granny. 
train_hindifullfemale_01818| One day Blackie wanted Granny to go off to the woods with him. 
train_hindifullfemale_01819| I can't go, Blackie, dear. I have too much work to do. 
train_hindifullfemale_01820| Then Blackie looked at her and saw that she was growing old and feeble. 
train_hindifullfemale_01821| I am young and strong, he thought. 
train_hindifullfemale_01822| I will see if I can find some work to do. 
train_hindifullfemale_01823| If I could bring some money home to her, she would not have to work so hard. 
train_hindifullfemale_01824| So next morning, bright and early, he started down to the river bank. 
train_hindifullfemale_01825| There he found a man who was in great trouble. 
train_hindifullfemale_01826| There was a long line of wagons so heavily loaded that the oxen could not draw them through the shallow water. 
train_hindifullfemale_01827| When the man saw Blackie standing on the bank he asked, Who owns this Elephant? 
train_hindifullfemale_01828| I want to hire him to help my Oxen pull these wagons across the river. 
train_hindifullfemale_01829| A child standing near by said, That is Granny's Blackie. 
train_hindifullfemale_01830| Very well, said the man, I will pay two pieces of silver for each wagon this Elephant draws across the river. 
train_hindifullfemale_01831| Blackie was glad to hear this promise. 
train_hindifullfemale_01832| He went into the river, and drew one wagon after another across to the other side. 
train_hindifullfemale_01833| Then he went up to the man for the money. 
train_hindifullfemale_01834| The man counted out one piece of silver for each wagon. 
train_hindifullfemale_01835| When Blackie saw that the man had counted out but one piece of silver for each wagon, instead of two, he would not touch the money at all. 
train_hindifullfemale_01836| He stood in the road and would not let the wagons pass him. 
train_hindifullfemale_01837| The man tried to get Blackie out of the way, but not one step would he move. 
train_hindifullfemale_01838| Then the man went back and counted out another piece of silver for each of the wagons and put the silver in a bag tied around Blackie's neck. 
train_hindifullfemale_01839| Then Blackie started for home, proud to think that he had a present for Granny. 
train_hindifullfemale_01840| The children had missed Blackie and had asked Granny where he was, but she said she did not know where he had gone. 
train_hindifullfemale_01841| They all looked for him, but it was nearly night, before they heard him coming. 
train_hindifullfemale_01842| Where have you been, Blackie? And what is that around your neck, the children cried, running to meet their playmate. 
train_hindifullfemale_01843| But Blackie would not stop to talk with his playmates. 
train_hindifullfemale_01844| He ran straight home to Granny. 
train_hindifullfemale_01845| Oh, Blackie! she said, Where have you been? 
train_hindifullfemale_01846| What is in that bag? And she took the bag off his neck. 
train_hindifullfemale_01847| Blackie told her that he had earned some money for her. 
train_hindifullfemale_01848| Oh, Blackie, Blackie, said Granny, how hard you must have worked to earn these pieces of silver! What a good Blackie you are! 
train_hindifullfemale_01849| And after that Blackie did all the hard work and Granny rested, and they were both very happy. 
train_hindifullfemale_01850| Long Ago there was a summer when very little rain fell. 
train_hindifullfemale_01851| All the Animals suffered for want of water, but the Fishes suffered most of all. 
train_hindifullfemale_01852| In one pond full of Fishes, the water was very low indeed. 
train_hindifullfemale_01853| A Crane sat on the bank watching the Fishes. 
train_hindifullfemale_01854| What are you doing? asked a little Fish. 
train_hindifullfemale_01855| I am thinking about you Fishes there in the pond. 
train_hindifullfemale_01856| It is so nearly dry, answered the Crane. 
train_hindifullfemale_01857| Yes, the Crane went on, I was wishing I might do something for you. 
train_hindifullfemale_01858| I know of a pond in the deep woods where there is plenty of water. 
train_hindifullfemale_01859| I declare, said the little Fish, you are the first Crane that ever offered to help a Fish. 
train_hindifullfemale_01860| That may be, said the Crane, but the water is so low in your pond. 
train_hindifullfemale_01861| I could easily carry you one by one on my back to that other pond 
train_hindifullfemale_01862| There is plenty of water, food and cool shade there. 
train_hindifullfemale_01863| I do not believe there is any such pond, said the little Fish. 
train_hindifullfemale_01864| What you wish to do is to eat us, one by one. 
train_hindifullfemale_01865| If you do not believe me, said the Crane, send with me one of the Fishes whom you can believe. 
train_hindifullfemale_01866| I will show him the pond and bring him back to tell you all about it. 
train_hindifullfemale_01867| A big Fish heard the Crane. 
train_hindifullfemale_01868| He said, I will go with you to see the pond. 
train_hindifullfemale_01869| I may as well be eaten by the Crane as to die here. 
train_hindifullfemale_01870| So the Crane put the big Fish on his back and started for the deep woods. 
train_hindifullfemale_01871| Soon the Crane showed the big Fish the pool of water. 
train_hindifullfemale_01872| See how cool and shady it is here, he said, and how much larger the pond is, and how full it is! 
train_hindifullfemale_01873| Yes! said the big Fish, take me back to the little pond and I will tell the other Fishes all about it. 
train_hindifullfemale_01874| So back they went. The Fishes all wanted to go when they heard the big Fish talk about the fine pond which he had seen. 
train_hindifullfemale_01875| Then the Crane picked up another Fish and carried it away. 
train_hindifullfemale_01876| Not to the pool, but into the woods where the other Fishes could not see them. 
train_hindifullfemale_01877| Then the Crane put the Fish down and ate it. 
train_hindifullfemale_01878| The Crane went back for another Fish. 
train_hindifullfemale_01879| He carried it to the same place in the woods and ate it, too. 
train_hindifullfemale_01880| This he did until he had eaten all the Fishes in the pond. 
train_hindifullfemale_01881| The next day the Crane went to the pond to see if he had left a Fish. 
train_hindifullfemale_01882| There was not one left, but there was a Crab on the sand. 
train_hindifullfemale_01883| Little Crab, would you let me take you to the fine pond in the deep woods where I took the Fishes? asked the crane. 
train_hindifullfemale_01884| But how could you carry me? asked the Crab. 
train_hindifullfemale_01885| Oh, easily, answered the Crane. 
train_hindifullfemale_01886| I will take you on my back as I did the Fishes. 
train_hindifullfemale_01887| No, I thank you, said the Crab, I can't go that way. 
train_hindifullfemale_01888| I am afraid you might drop me. 
train_hindifullfemale_01889| If I could take hold of your neck with my claws, I would go. 
train_hindifullfemale_01890| You know we Crabs have a tight grip. 
train_hindifullfemale_01891| The Crane knew about the tight grip of the Crabs, and he did not like to have the Crab hold on with his claws. 
train_hindifullfemale_01892| But he was hungry, so he said, Very well, hold tight. 
train_hindifullfemale_01893| And off went the Crane with the Crab. 
train_hindifullfemale_01894| When they reached the place where the Crane had eaten the Fishes, the Crane said, I think you can walk the rest of the way. 
train_hindifullfemale_01895| Let go of my neck. I see no pond, said the Crab. 
train_hindifullfemale_01896| All I can see is a pile of Fish bones. 
train_hindifullfemale_01897| Is that all that is left of the Fishes?. 
train_hindifullfemale_01898| Yes, said the Crane, and if you will let go of my neck, your shell will be all that will be left of you. 
train_hindifullfemale_01899| And the Crane put his head down near the ground so that the Crab could get off easily. 
train_hindifullfemale_01900| But the Crab pinched the Crane's neck so that his head fell off. 
train_hindifullfemale_01901| Not my shell, but your bones are left to dry with the bones of the Fishes, said the Crab. 
train_hindifullfemale_01902| Why is it that Crows torment the Owls as they sleep in the daytime? 
train_hindifullfemale_01903| For the same reason that the Owls try to kill the Crows while they sleep at night. 
train_hindifullfemale_01904| Listen to a tale of long ago and then you will see why. 
train_hindifullfemale_01905| Once upon a time, the people who lived together when the world was young took a certain man for their king. 
train_hindifullfemale_01906| The four footed animals also took one of their number for their king. 
train_hindifullfemale_01907| The fish in the ocean chose a king to rule over them. 
train_hindifullfemale_01908| Then the birds gathered together on a great flat rock. 
train_hindifullfemale_01909| One of them said, Among men there is a king, and among the beasts, and the fish have one too; but we birds have none. 
train_hindifullfemale_01910| We ought to have a king, Let us choose one now. 
train_hindifullfemale_01911| And so the birds talked the matter over and at last they all said, Let us have the Owl for our king. 
train_hindifullfemale_01912| No, not all, for one old Crow rose up and said, For my part, I do not want the Owl to be our king. 
train_hindifullfemale_01913| Look at him now while you are all crying that you want him for your king. 
train_hindifullfemale_01914| See how sour he looks right now. 
train_hindifullfemale_01915| If that's the cross look he wears when he is happy, how will he look when he is angry? 
train_hindifullfemale_01916| I, for one, want no such sour looking king! 
train_hindifullfemale_01917| Then the Crow flew up into the air crying, I do not like it! 
train_hindifullfemale_01918| The Owl rose and followed him. 
train_hindifullfemale_01919| From that time on the Crows and the Owls have been enemies. 
train_hindifullfemale_01920| The birds chose a turtle Dove to be their king, and then flew to their homes. 
train_hindifullfemale_01921| Once upon a time, there was a swan that had striking golden feathers. 
train_hindifullfemale_01922| This swan lived in a pond. 
train_hindifullfemale_01923| There was a house near this pond, where a poor woman lived with her two daughters. 
train_hindifullfemale_01924| The people were really poor and were leading a tough life. 
train_hindifullfemale_01925| The swan found that the poor mother was passing a hard time with her daughters. 
train_hindifullfemale_01926| The swan thought, If I give them one after another of my golden feathers, the mother can sell them. 
train_hindifullfemale_01927| She and her daughters can live in comfort with the money raised from it. 
train_hindifullfemale_01928| After thinking about this, the swan flew away to the poor woman's house. 
train_hindifullfemale_01929| On seeing the swan inside the house, the woman said, Why have you come here? We have nothing to offer you. 
train_hindifullfemale_01930| The Swan replied, I have not come to take anything, but I have something to give you. 
train_hindifullfemale_01931| I know your condition and I will give my golden feathers one by one and you can sell them. 
train_hindifullfemale_01932| With the money raised through it, you people can easily live in comfort. 
train_hindifullfemale_01933| After saying this, the swan shed one of her feathers and then flew away. 
train_hindifullfemale_01934| This became a regular feature and from time to time, the swan came back and every time left another feather. 
train_hindifullfemale_01935| Like this, the mother and her daughters were happily leading their life by selling the feathers of the golden swan. 
train_hindifullfemale_01936| Each golden feather got them enough money to keep them in comfort. 
train_hindifullfemale_01937| But the mother became greedy to get all the feathers as soon as possible. 
train_hindifullfemale_01938| One day, she said to her daughters, 
train_hindifullfemale_01939| Now, we will not trust this swan, possibly she may fly away and never come back. 
train_hindifullfemale_01940| If this would happen, we will be poor again. 
train_hindifullfemale_01941| We will take all of her feathers, when she will come the next time. 
train_hindifullfemale_01942| The innocent daughters replied, Mother, this will hurt the swan. 
train_hindifullfemale_01943| We will not cause any pain to her. 
train_hindifullfemale_01944| But the mother was determined to catch hold the swan the very next time she comes. 
train_hindifullfemale_01945| Next time, when the swan came, the mother caught her and pulled out all of her feathers. 
train_hindifullfemale_01946| Now, the golden feathers of the swan changed into some strange feathers. 
train_hindifullfemale_01947| The mother was shocked to see such feathers. 
train_hindifullfemale_01948| The Golden Swan said, Poor Mother, I wanted to help you, but you wanted to kill me instead. 
train_hindifullfemale_01949| As per my wish, I used to give you the golden feather. 
train_hindifullfemale_01950| Now, I think there is no need to help you. 
train_hindifullfemale_01951| Now, my feathers are nothing more than chicken feathers for you. 
train_hindifullfemale_01952| I am going from this place and will never come back. 
train_hindifullfemale_01953| The mother felt sorry and apologized for the mistake committed by her. 
train_hindifullfemale_01954| The Golden Swan said, Never be greedy, and flew away. 
train_hindifullfemale_01955| From this we can learn a lesson of Excess greed brings nothing. 
train_hindifullfemale_01956| Stories, about Tenali Rama and his practical jokes on everyone around him including distinguished fellow poets and the emperor himself, abound in south India. 
train_hindifullfemale_01957| His fame spread beyond Vijaynagar, to areas that come in Tamil Nadu and Karnataka today. 
train_hindifullfemale_01958| Tenali Rama was also a great scholar of several languages that included Marathi, Tamil and Kannada. 
train_hindifullfemale_01959| King Krishnadeva Rayar had some superior quality brinjal plants growing in his private garden. 
train_hindifullfemale_01960| No one was allowed to view the garden without the king's permission, let alone taste the brinjal. 
train_hindifullfemale_01961| Once the king invited his courtiers to a feast in which the brinjal was served. 
train_hindifullfemale_01962| Tenali Rama enjoyed the vegetable so much that he talked to his wife about it on returning home so much so that she insisted on tasting it. 
train_hindifullfemale_01963| How can I get them for you? Tenali Rama asked. 
train_hindifullfemale_01964| The king is so possessive about the vegetable that he can detect the theft of even one brinjal from his garden. 
train_hindifullfemale_01965| And, I'm sure that he would want the thief's head chopped off right then, if he caught him red handed. 
train_hindifullfemale_01966| But Tenali's wife begged him to allow her to taste the brinjal. 
train_hindifullfemale_01967| Tenali Rama was helpless, and after much deliberation, he agreed to his wife's demand. 
train_hindifullfemale_01968| One night he quietly jumped into the king's garden and plucked a few brinjals from the garden. 
train_hindifullfemale_01969| His wife cooked them with zeal and was all praise for the taste. 
train_hindifullfemale_01970| She wanted to let their six year old son also taste the vegetable, but Tenali Rama asked her not to. 
train_hindifullfemale_01971| Do not make such a mistake, he warned her. 
train_hindifullfemale_01972| If he happens to tell somebody, we will be in deep trouble. 
train_hindifullfemale_01973| But his wife did not agree, and asked How is that possible? 
train_hindifullfemale_01974| How can we eat something whose taste we shall remember forever and not share it with our son! 
train_hindifullfemale_01975| Find a way out so that he gets to taste the vegetable and nobody is able to prove that we stole it from the king's garden. 
train_hindifullfemale_01976| Tenali Rama had no option but to nod his head in agreement. 
train_hindifullfemale_01977| He filled a bucket with water and went upstairs to the roof where his son was sleeping. 
train_hindifullfemale_01978| He poured the water on the child. 
train_hindifullfemale_01979| Then he picked up the child and said, It is raining, Let us go inside the house. 
train_hindifullfemale_01980| Once in, he got the child's clothes changed and gave him the vegetable to eat. 
train_hindifullfemale_01981| He again remarked that it was raining outside, and let the boy sleep in the room. 
train_hindifullfemale_01982| The next day the king came to know of the theft in his garden. 
train_hindifullfemale_01983| The royal gardener who kept a head count of each vegetable and flower, found one brinjal missing. 
train_hindifullfemale_01984| It became the talk of the town. 
train_hindifullfemale_01985| The king declared a huge prize on the thief's head. 
train_hindifullfemale_01986| Chief Minister Appaji suspected that only Tenali Rama was capable of such an audacious act. 
train_hindifullfemale_01987| He let the king know about his suspicion. 
train_hindifullfemale_01988| The king said, I know he is very clever and always gets out of charges on one pretext or the other. 
train_hindifullfemale_01989| It is better that we call his son. 
train_hindifullfemale_01990| We will find the truth through him. 
train_hindifullfemale_01991| Tenali will lie to get out of any situation, but he would never ask the child to do so. 
train_hindifullfemale_01992| Tenali Rama's son was called, and he was asked what vegetable he ate the night before. 
train_hindifullfemale_01993| The child replied, the brinjal and it was the tastiest vegetable I have ever eaten. 
train_hindifullfemale_01994| Chief Minister Appaji told Tenali Rama, Now you will have to accept your guilt. 
train_hindifullfemale_01995| Why should I when I'm not guilty? replied Tenali Rama. 
train_hindifullfemale_01996| The boy went to sleep very early last night and seems to have had many dreams. 
train_hindifullfemale_01997| That is why he is talking nonsense about brinjals and rain and what not. 
train_hindifullfemale_01998| Ask him if it rained last night or not. 
train_hindifullfemale_01999| Appaji asked the child, How was the weather last night? 
train_hindifullfemale_02000| Was the sky clear or did it rain?. 
train_hindifullfemale_02001| The child replied, It rained heavily last night. 
train_hindifullfemale_02002| All my clothes got wet when I slept on the roof. 
train_hindifullfemale_02003| The fact was, not a single drop of rain had fallen on Vijaynagar that day. 
train_hindifullfemale_02004| Appaji had no option but to get rid of his suspicions in the face of such apparent madness. 
train_hindifullfemale_02005| He apologised to Tenali Rama for having suspected him. 
train_hindifullfemale_02006| Tenaliraman was mischievous during his childhood. 
train_hindifullfemale_02007| His childishness cheered some and troubled some. 
train_hindifullfemale_02008| His activities were pleasure to some and humiliation to others. 
train_hindifullfemale_02009| Once, while Tenaliraman was pursuing his academics, the provincial ruler visited the school as part of checking the standards of the school. 
train_hindifullfemale_02010| He questioned the children in the classroom, Who among you is the most intelligent? 
train_hindifullfemale_02011| Silence spread in the class, No child dared to give reply to the King's question. 
train_hindifullfemale_02012| Meanwhile, Tenaliraman sprung up from his seat and answered with confidence. 
train_hindifullfemale_02013| I am the intelligent student in the class. 
train_hindifullfemale_02014| The King appreciated Tenaliraman's confidence and courage. 
train_hindifullfemale_02015| Calling him closer, the King enquired him about several things and blessed him, You will go places my child. 
train_hindifullfemale_02016| Similarly, Tenaliraman grew big and made his presence felt in history. 
train_hindifullfemale_02017| Tenaliraman practiced poetry and composition along with command on language and grammar. 
train_hindifullfemale_02018| Mingling with a group of minstrels, he learnt the art of spontaneous poetry composing techniques at Tenali. 
train_hindifullfemale_02019| He made himself a perfectionist in Sanskrit and Telugu languages. 
train_hindifullfemale_02020| Gradually, in the natural process of growing up, he was married and was blessed with children. 
train_hindifullfemale_02021| From then onwards, he was compelled to find ways to earn a living and feed his family. 
train_hindifullfemale_02022| He learnt that Vijaya Nagar ruler Sri Krishna Deva Rayar was a revered patron for poetry and poets. 
train_hindifullfemale_02023| He was also a scholar in Kannada, Andhra and Sanskrit languages on par. 
train_hindifullfemale_02024| Tenaliraman headed for Vijaya Nagar to get into the royal court. 
train_hindifullfemale_02025| First, he approached the royal priest Thathacharya and laid his heart before him, after exhibiting his skills. 
train_hindifullfemale_02026| Thathacharya promised Tenaliraman to introduce him to the King Rayar. 
train_hindifullfemale_02027| Satisfied Tenaliraman spent many a days in vain, waiting for the opportunity. 
train_hindifullfemale_02028| Tenaliraman was vexed and started hunting for alternative ways that would gain entry into the court. 
train_hindifullfemale_02029| He then located Nandi Thimmana, another scholar who had a permanent place in the royal court. 
train_hindifullfemale_02030| Tenaliraman approached Thimmana and appeased him with his expertise in spontaneous poetry. 
train_hindifullfemale_02031| Thimmana felicitated Tenaliraman by presenting him with a Kashmir Shawl. 
