train_hindifullfemale_03438| Though you are talking like a learned man, you forget that learned men do not think of the past or the dead. 
train_hindifullfemale_03439| These words of Sham worked like a tonic providing relief to Lion's troubled mind. 
train_hindifullfemale_03440| Pleased with this advice, the lion king reappointed Sham as his minister and continued to rule the forest. 
train_hindifullfemale_03441| Then the two foxes sat on discussing many worldly wise stories. 
train_hindifullfemale_03442| Ram blamed shyam for his action and said You have the example of the bird muktha. 
train_hindifullfemale_03443| I am eager to know what it is, said Sham. 
train_hindifullfemale_03444| The story of muktha and The monkey. 
train_hindifullfemale_03445| A gang of monkeys made their home in a mountain slope. 
train_hindifullfemale_03446| When winter came, it brought not only severe cold but also heavy rains. 
train_hindifullfemale_03447| Unable to stand the cold, the monkey collected red berries wildly growing in the mountain slope. 
train_hindifullfemale_03448| They gathered around the berries and began blowing air at them thinking they were embers. 
train_hindifullfemale_03449| Watching their vain effort in amusement, muktha, a bird, told them, You fools, they are not embers but red berries. 
train_hindifullfemale_03450| Why do you waste your energy on them? This will not save you from cold. 
train_hindifullfemale_03451| Go and look for a shelter in a cave or a place free from wind. 
train_hindifullfemale_03452| The clouds are thick and there will be no immediate relief from rain. 
train_hindifullfemale_03453| An old member of the monkey gang angrily told the bird, Why do you poke your nose in our affairs? Go away. 
train_hindifullfemale_03454| Haven't the elders said that he who cherishes his welfare should not talk to a gambler or an inefficient workman. 
train_hindifullfemale_03455| So is the person a fool who talks to an idiot or a pleasure seeker. 
train_hindifullfemale_03456| Disregarding the old monkey's anger and not giving room to any other monkey to talk. 
train_hindifullfemale_03457| Muktha went on repeating his advice to them to seek shelter elsewhere. 
train_hindifullfemale_03458| Tired with the bird's unwanted advice, one of the monkey sprang at the bird and bashed him against a rock till he was dead. 
train_hindifullfemale_03459| Ram said at the end of the story, If you counsel a fool it will only provoke him and not pacify. 
train_hindifullfemale_03460| If you feed milk to a snake it will increase its store of poison. 
train_hindifullfemale_03461| That's why you should not offer advice to everyone. 
train_hindifullfemale_03462| Look, how two good sparrows lost their home, all due to a foolish monkey. 
train_hindifullfemale_03463| At Sham's request, Ram began telling the story of the evil monkey. 
train_hindifullfemale_03464| Fools ignore advice and wise men follow it and benefit by it. 
train_hindifullfemale_03465| It is clear that you haven't heard the story of dharma and his Son, the story of how the father was killed by smoke due to the son's thoughtlessness. 
train_hindifullfemale_03466| Why do you not tell me that story, asked Sham. 
train_hindifullfemale_03467| In a city in the north, lived two friends named dharma and Karan. 
train_hindifullfemale_03468| One day, Karan thought, I am a man without worldly wisdom and added to that I am also poor. 
train_hindifullfemale_03469| Let me persuade Dharma to take me to far off lands and earn lots of money through his business skills. 
train_hindifullfemale_03470| Later I will deprive him of all his wealth and live happily ever after. 
train_hindifullfemale_03471| With these plans in his mind, Karan told Dharma, My friend, you are growing old and cannot manage your business. 
train_hindifullfemale_03472| Unless you go out into the wide world how can you tell your children about the wonders of the world? 
train_hindifullfemale_03473| Elders have said that he is born in vain who does not see the countries in the world, learn several languages and know the dress styles of other people. 
train_hindifullfemale_03474| You cannot earn wealth and knowledge without wide travel. 
train_hindifullfemale_03475| Dharma liked this advice and taking the blessings of his teachers set out on overseas travel, taking Karan with him. 
train_hindifullfemale_03476| Both of them earned a lot of money abroad due to the business talent of Dharma. 
train_hindifullfemale_03477| It was time for them to return home because it is natural for people who go abroad in search of wealth and learning to think of home when they have achieved both. 
train_hindifullfemale_03478| As they were entering their native place, Karan told Dharma, It is not safe to take home all this wealth. 
train_hindifullfemale_03479| Because relatives and friends in need will seek help if they know about our riches. 
train_hindifullfemale_03480| We shall bury most of our money in some secret place in this forest. 
train_hindifullfemale_03481| Whenever we need money, we can come here and take whatever we need. 
train_hindifullfemale_03482| You know that money tempts even saints. 
train_hindifullfemale_03483| Dharma agreed to Karan's plan and went home after both of them dug a pit and covered it after burying most of their earnings in it. 
train_hindifullfemale_03484| One midnight Karan went to the secret place in the forest and stole all the money and brought it home. 
train_hindifullfemale_03485| Next morning, he went to Dharma and suggested that they should go to the forest because he was in need of money. 
train_hindifullfemale_03486| When both of them arrived at the secret spot in the forest and dug there, they found the pit empty. 
train_hindifullfemale_03487| At once Karan began shouting loudly, Dharma, you stole the money and nobody else. 
train_hindifullfemale_03488| The pit was carefully covered. 
train_hindifullfemale_03489| You must give me half of what we have buried here. 
train_hindifullfemale_03490| Though Dharma denied it, Karan insisted that they should take the dispute to a court of law. 
train_hindifullfemale_03491| When the case came before the court, the judge asked them to take oath in the name of God. 
train_hindifullfemale_03492| But Karan quoted experts as saying that relevant documents should be produced first as proof. 
train_hindifullfemale_03493| Then let the witnesses would be summoned to give evidence and oath in the name of God is taken when neither documents nor witnesses are available. 
train_hindifullfemale_03494| I can produce the gods of the forest as witnesses. 
train_hindifullfemale_03495| They will determine who is guilty and who is innocent, said Karan. 
train_hindifullfemale_03496| Impressed by this plan, the judges asked both the parties to be present next morning at the forest for a hearing. 
train_hindifullfemale_03497| Happy at the judges' order, Karan went home and told his father, Father, I have stolen all Dharma's money. 
train_hindifullfemale_03498| There is a case in the court that I can win only with your help. 
train_hindifullfemale_03499| Otherwise, my life will be in danger. 
train_hindifullfemale_03500| What have I to do to get that money, son, asked his father. 
train_hindifullfemale_03501| There is a big tree there. 
train_hindifullfemale_03502| You have to go now and hide in the hollow of that tree. 
train_hindifullfemale_03503| Tomorrow morning when the judges and others assemble there, I will ask you to tell the truth. 
train_hindifullfemale_03504| Then it is your turn to declare that Dharma is the thief, said the son. 
train_hindifullfemale_03505| The father left at once for the forest to hide in the hollow of the tree. 
train_hindifullfemale_03506| The morning of the next day, the son took a bath and went to the tree taking Dharma and the judges with him. 
train_hindifullfemale_03507| Karan went near the tree and shouted, sun, moon, air, fire, earth, water, the God of Death, day and night, you are all witnesses to the history of humanity. 
train_hindifullfemale_03508| Goddess of the Forest, declare who among us is guilty. 
train_hindifullfemale_03509| The father shouted back from inside the hollow of the tree, Listen all of you, it is Dharma who stole the money. 
train_hindifullfemale_03510| The judges and the king's men heard the verdict and sat down to decide what punishment they should give Dharma. 
train_hindifullfemale_03511| Meanwhile, Dharma filled the hollow with rags and hay, poured oil on them and threw a matchstick into it. 
train_hindifullfemale_03512| The fire forced the half burnt father to come out of the tree. 
train_hindifullfemale_03513| All this is the work of Karan's evil mind, said the father and soon collapsed and died. 
train_hindifullfemale_03514| The king's men at once bound Karan hand and foot and hung him to a tree. 
train_hindifullfemale_03515| They said, Our elders have always said that wise men should not only be resourceful but also know the consequences of being resourceful. 
train_hindifullfemale_03516| You have the story of how a mongoose killed all the offspring of the crane before his own eyes. 
train_hindifullfemale_03517| When Dharma asked them to tell the story, the king's men began relating the story. 
train_hindifullfemale_03518| The story of a foolish crane and a mongoose. 
train_hindifullfemale_03519| A big banyan tree was home to a number of cranes in a forest. 
train_hindifullfemale_03520| In the hollow of that tree lived a cobra, which used to feed on the young cranes which did not yet learn to fly. 
train_hindifullfemale_03521| When the mother crane saw the cobra killing her offspring, she began crying. 
train_hindifullfemale_03522| Seeing the sorrowing crane, a crab asked her what made her cry. 
train_hindifullfemale_03523| The crane told the crab, Every day, the cobra living in this tree is killing my children. 
train_hindifullfemale_03524| I am not able to contain my grief. 
train_hindifullfemale_03525| Please show me some way to get rid of this cobra. 
train_hindifullfemale_03526| The crab then thought, These cranes are our born enemies. 
train_hindifullfemale_03527| I shall give her advice that is misleading and suicidal. 
train_hindifullfemale_03528| That will see the end of all these cranes. 
train_hindifullfemale_03529| Elders have always said that if you want to wipe out your enemy your words should be soft like butter and your heart like a stone. 
train_hindifullfemale_03530| Then the crab told the crane, Uncle, strew pieces of meat from the mongoose's burrow to the hollow of the cobra. 
train_hindifullfemale_03531| The mongoose will follow the trail of meat to the cobra burrow and will kill it. 
train_hindifullfemale_03532| The crane did as the crab advised her. 
train_hindifullfemale_03533| The mongoose came following the meat trail and killed not only the cobra but also all the cranes on the tree. 
train_hindifullfemale_03534| That is why, the king's men said, if you have a strategy, you must also know what the strategy would lead to. 
train_hindifullfemale_03535| Karan considered only the crooked plan but not what would follow. 
train_hindifullfemale_03536| He reaped the consequences. 
train_hindifullfemale_03537| Ram told Sham, That's why like Karan you haven't foreseen what will happen if you went ahead with your plans. 
train_hindifullfemale_03538| You have an evil mind, I knew it from your plans to endanger the life of our lord. 
train_hindifullfemale_03539| Your place is not with us. 
train_hindifullfemale_03540| If a rat had a thousand pound scale for its lunch, is it any wonder that a kite carried away a child? 
train_hindifullfemale_03541| What about it, asked Sham. 
train_hindifullfemale_03542| Ram told him the following story. 
train_hindifullfemale_03543| Raman was the son of a rich merchant. 
train_hindifullfemale_03544| But he had lost all his wealth. 
train_hindifullfemale_03545| He thought he should go abroad. 
train_hindifullfemale_03546| He told himself that he who had once prospered should not live in the same place as a poor man. 
train_hindifullfemale_03547| People who respected him once would now look down upon him and shun him. 
train_hindifullfemale_03548| Deciding to go abroad to seek his fortune, he mortgaged with a local merchant the thousand pound balance his ancestors had left behind. 
train_hindifullfemale_03549| He went abroad with the money the merchant gave him and after several years came home and asked the merchant to return him the balance. 
train_hindifullfemale_03550| The merchant said, where is the balance? The rats have gnawed at it for food. 
train_hindifullfemale_03551| Raman replied without emotion, I cannot blame you for what the rats have done. 
train_hindifullfemale_03552| The world is like that. Nothing really is permanent. 
train_hindifullfemale_03553| Any way, I am going to the river to take the purification bath. 
train_hindifullfemale_03554| Please send with me your son Deva to look after my needs. 
train_hindifullfemale_03555| Afraid that Raman would accuse him of theft, the merchant called his son and told him, Son, your uncle is going to the river for a bath. 
train_hindifullfemale_03556| You accompany him taking with you all the things he needs to take his bath. 
train_hindifullfemale_03557| Men offer help not only out of kindness but also out of fear, greed etc. 
train_hindifullfemale_03558| If one offers help for reasons other than this, you have to be wary of such a person. 
train_hindifullfemale_03559| The merchant's son followed Raman to the river. 
train_hindifullfemale_03560| After taking bath, he led the boy into a nearby cave and, pushing the boy inside, closed it with a huge boulder. 
train_hindifullfemale_03561| When Raman returned from the river, the merchant asked him, honoured guest, didn't you bring back my son? 
train_hindifullfemale_03562| Where is he? Please tell me. 
train_hindifullfemale_03563| Raman told him, A kite has carried away your boy. 
train_hindifullfemale_03564| There was nothing I could do. 
train_hindifullfemale_03565| You cheat, is this possible? 
train_hindifullfemale_03566| How can a kite carry away a boy? Bring my boy back. 
train_hindifullfemale_03567| Otherwise, I will go to the king and complain. 
train_hindifullfemale_03568| Yes, just as a kite cannot carry away a boy, rats also cannot eat away heavy iron balance. 
train_hindifullfemale_03569| If you want your boy, give me back my balance, said Raman. 
train_hindifullfemale_03570| Both of them took the dispute to the king's court. 
train_hindifullfemale_03571| The merchant complained to the judges that Raman had kidnapped his child. 
train_hindifullfemale_03572| The judges ordered him to return the boy to the merchant. 
train_hindifullfemale_03573| Raman told the judges the entire story. 
train_hindifullfemale_03574| There upon, the judges ordered Raman to return the boy and the merchant to give back the balance to Raman. 
train_hindifullfemale_03575| Ram then told Sham, You have done this foul deed because you were jealous of the king's friendship with Bullock. 
train_hindifullfemale_03576| It is not without reason that our elders have said,. 
train_hindifullfemale_03577| Fools hate the learned. 
train_hindifullfemale_03578| The poor blame the rich. 
train_hindifullfemale_03579| The miser riles the giver. 
train_hindifullfemale_03580| The wicked abhor the virtuous. 
train_hindifullfemale_03581| You have tried to help us. 
train_hindifullfemale_03582| But you have hurt us. 
train_hindifullfemale_03583| It is like the well meaning monkey killing the king, said Ram. 
train_hindifullfemale_03584| What did the monkey do? asked Sham. 
train_hindifullfemale_03585| Once upon a time, there was a king who kept a monkey as a pet. 
train_hindifullfemale_03586| The monkey served the king in whatever way he could. 
train_hindifullfemale_03587| He had a free run of the royal household because he was the king's pet. 
train_hindifullfemale_03588| One hot day the monkey sat fanning by the side of the king who was sleeping. 
train_hindifullfemale_03589| He noticed a fly on the chest of the king and tried to swish it away. 
train_hindifullfemale_03590| The fly would go away for the moment and come back again to sit on the king's chest. 
train_hindifullfemale_03591| The monkey could take it no longer and decided to teach the fly a lesson. 
train_hindifullfemale_03592| He looked for a dagger to kill it and when he found it brought it down with all force on the fly. 
train_hindifullfemale_03593| The fly flew away but the king died as result of the dagger blow delivered by the monkey. 
train_hindifullfemale_03594| Ram said, Therefore, the lesson is that a king who cares for his life should not have a fool as his servant. 
train_hindifullfemale_03595| He went on to relate a second story to show how shrewd people save the lives of others. 
train_hindifullfemale_03596| Once upon a time a man lived in a big city and as a result of his misdeeds in his previous birth he became a thief. 
train_hindifullfemale_03597| He saw four merchants from another city selling a variety of goods in his city. 
train_hindifullfemale_03598| He thought he should somehow deprive the four merchants of their money and through sweet words become their good friend. 
train_hindifullfemale_03599| He was useful to them in whatever way he could. 
train_hindifullfemale_03600| True, it comes naturally for women of vice to act coy and for charlatans to pretend to be learned. 
train_hindifullfemale_03601| The four visitors sold all their goods and with the money from the sales bought pearls and precious jewels. 
train_hindifullfemale_03602| The thief was keeping an eye on what they were doing even as he pretended to serve them faithfully. 
train_hindifullfemale_03603| One day, in the presence of the thief, the traders cut open their thighs and storing the jewels and pearls inside the thighs sewed them back. 
train_hindifullfemale_03604| The thief was disappointed that they did not give him even a small part of their wealth. 
train_hindifullfemale_03605| He immediately decided to follow them and kill them in the middle of their journey back home and take all that wealth from them. 
train_hindifullfemale_03606| He told the traders with tears in his eyes, Friends, you seem to be ready to leave me behind. 
train_hindifullfemale_03607| My heart is broken because it is difficult for me to snap the bonds of friendship with you. 
train_hindifullfemale_03608| If you will be so kind as to take me with you, I will be very grateful to you. 
train_hindifullfemale_03609| Moved by his request, the traders started their homeward journey accompanied by the Brahmin thief. 
train_hindifullfemale_03610| They passed through several villages, towns and cities before they reached a village inhabited by thugs. 
train_hindifullfemale_03611| Suddenly, they heard a group of crows loudly shouting, You thugs, very rich people are coming. 
train_hindifullfemale_03612| Come, kill them and become rich. 
train_hindifullfemale_03613| The thugs at once attacked the traders with sticks and began examining their bags. 
train_hindifullfemale_03614| But they found nothing. 
train_hindifullfemale_03615| They were surprised because this was the first time that the words of the crows turned out to be false. 
train_hindifullfemale_03616| They told the traders, traders, the crows always tell the truth. 
train_hindifullfemale_03617| You have the money with you somewhere. 
train_hindifullfemale_03618| Take it out or we will cut every limb of yours and bring it out. 
train_hindifullfemale_03619| The thief pondered, These thugs will certainly pierce the body of the traders to grab the jewels. 
train_hindifullfemale_03620| My turn also will come. 
train_hindifullfemale_03621| It is better I offer myself to these thugs and save the lives of the Merchants. 
train_hindifullfemale_03622| There is no point in fearing death because it will come today or after hundred years, One cannot escape it. 
train_hindifullfemale_03623| With these thoughts on his mind, the thief asked the thugs to first kill him and see if there was anything valuable on his body. 
train_hindifullfemale_03624| The thugs accepted the offer and found nothing on him after they pierced his body. 
train_hindifullfemale_03625| They let go the other four merchants thinking that they also did not have anything precious on their bodies. 
train_hindifullfemale_03626| Gaining Friends, This is the second strategy of Panchatantra known as Gaining Friends beginning with this stanza. 
train_hindifullfemale_03627| Even without the wherewithal, Learned men and intellectuals. 
train_hindifullfemale_03628| Achieve what they want like, the crow, the rat, the deer and the turtle. 
train_hindifullfemale_03629| There was a city in the south not far off from where was a large banyan tree. 
train_hindifullfemale_03630| Many species of birds came there to eat the tree's fruit. 
train_hindifullfemale_03631| In the hollow of the great tree lived poisonous reptiles like snakes and scorpions. 
train_hindifullfemale_03632| Travellers found the tree a great shelter in their journeys. 
train_hindifullfemale_03633| A crow made this tree his home. 
train_hindifullfemale_03634| As he was flying one day towards the city for collecting food, he sighted a hunter carrying a net and approaching the tree like a messenger of death. 
train_hindifullfemale_03635| The crow at once sensed danger. 
train_hindifullfemale_03636| The crow is pretty sure that the hunter will come to trap the birds on the tree. 
train_hindifullfemale_03637| He told all the birds, his Friends that the wicked hunter has seeds in his bag that he will scatter to lure you. 
train_hindifullfemale_03638| Do not trust him and avoid the seeds like poison. 
train_hindifullfemale_03639| The hunter came, sowed the seeds and spread the net. 
train_hindifullfemale_03640| He left the spot and sat elsewhere not to arouse the suspicion of the birds. 
train_hindifullfemale_03641| Warned by crow, the birds stayed away from the seeds as though they were poisonous berries. 
train_hindifullfemale_03642| Meanwhile, king of doves, saw the seeds from a distance and landed there with his retinue of one thousand doves. 
train_hindifullfemale_03643| They came to eat the seeds ignoring the warnings of crow and soon the hunter spread his net and trapped all of them. 
train_hindifullfemale_03644| That is why elders have said that fools can never foresee peril. 
train_hindifullfemale_03645| People often lose sense when danger lurks in the corner. 
train_hindifullfemale_03646| Dove King and his retinue, however, kept their cool in the face of danger. 
train_hindifullfemale_03647| He appealed to his friends not to panic. 
train_hindifullfemale_03648| Elders have said that they tide over danger, who are not scared by crisis. 
train_hindifullfemale_03649| Let us fly together and land elsewhere where the hunter cannot reach us. 
train_hindifullfemale_03650| We can then plan a strategy to get out of this net. 
train_hindifullfemale_03651| If we do not fly now, we are all doomed, said Dove King. 
train_hindifullfemale_03652| Thereupon, all of them flew together. 
train_hindifullfemale_03653| The hunter followed the flight of the doves and looking upwards chanted, They are flying together. 
train_hindifullfemale_03654| But the moment there is a break in their unity they will crash to the ground. 
train_hindifullfemale_03655| The crow, also followed the flying doves to see what they would do. 
train_hindifullfemale_03656| When he lost sight of the birds, the hunter gave up and went home ruing that he had lost his net also. 
train_hindifullfemale_03657| When he was sure that the hunter had failed to chase them, the king of the doves told his friends, 
train_hindifullfemale_03658| The hunter has disappeared. 
train_hindifullfemale_03659| Let us all now fly towards the city where I have a friend, who is a rat. 
train_hindifullfemale_03660| He is our only hope, It is only a friend who will come to the aid of those in trouble. 
train_hindifullfemale_03661| The birds, heeding the advice of the king, flew to the fort of rat in the city. 
train_hindifullfemale_03662| Standing outside the fort, Dove King shouted, friend, come quickly. 
train_hindifullfemale_03663| We are in great trouble. Without coming out, rat shouted back,Who are you sir and what do you want from me? 
train_hindifullfemale_03664| What is the kind of trouble that is bothering you? Let me know. 
train_hindifullfemale_03665| I am your friend king of the doves, Come out soon. 
train_hindifullfemale_03666| Rat came out and was happy to see Dove King with his retinue and asked what was the matter. 
train_hindifullfemale_03667| The king of the doves said, Whatever man does for whatever reasons, in whatever manner and wherever in his last birth. 
train_hindifullfemale_03668| He reaps the consequences for the same reasons, in the same manner and in the same place. 
train_hindifullfemale_03669| All of us are trapped in this net because of our weakness for food. 
train_hindifullfemale_03670| Come at once and free us from this trap, urged Dove King. 
train_hindifullfemale_03671| Rat said, It is rightly said that a bird can recognise food from fifty miles but cannot see the danger lurking next to him. 
train_hindifullfemale_03672| After delivering this sermon, the rat set out to free Dove King first. 
train_hindifullfemale_03673| But the king of doves pleaded with him to first liberate his friends. 
train_hindifullfemale_03674| The rat was angry and reminded Dove King that it was fair that the king became free first and then the servants. 
train_hindifullfemale_03675| No, it is not like that, countered Dove King. 
train_hindifullfemale_03676| They are all dedicated to my service and have left their families behind to come with me. 
train_hindifullfemale_03677| I have to repay that debt, he said. 
